{
  "case_id": "v5path-dev-semantic-axis-separation",
  "classification": "semantic_discrimination_bottleneck",
  "classification_policy": {
    "all_models_at_or_above_cutoff": "candidate_generation_bottleneck",
    "all_models_below_cutoff": "semantic_discrimination_bottleneck",
    "mixed": "undetermined"
  },
  "corpus_document_count": 93,
  "environment": {
    "architecture": "x86_64",
    "cpu_threads": 4,
    "fresh_runtime": true,
    "network": "disabled",
    "os": "linux",
    "python": "3.11.15",
    "runtime_seconds": 754.914628855,
    "shared_database_open_count": 0
  },
  "expected_source_id": "github:Liplus-Project/neuron-graph-rag:corpora/github-retrieval-parity-v4/rules/model/axis-separation.md",
  "inputs_sha256": {
    "tests/fixtures/full_corpus_rerank_oracle_v1.manifest.json": "c356cd5400b3e72b576e1f4aa24ec795440a40d72e81facaaad5d6e33fce2ea7",
    "tests/fixtures/full_corpus_rerank_oracle_v1.schema.json": "88f663af76becc1e440f2c50a5472f3b8242e97c56c13dc3cf9f47c0768fd4f6",
    "tests/fixtures/github_cross_encoder_precision_v8.models.json": "f8517c050b9ac2e10b1fa73fd4fc34c2a39f03830f5a29cf36847410a602a2b5",
    "tests/fixtures/github_retrieval_parity_v4.corpus.json": "0699010fe33887e613559ab28388a370cf0006396f9d17855a9b9b1ee9f00e8f",
    "tests/fixtures/github_retrieval_parity_v5.gold.json": "6caf7833c6b075fe6a394e03283d6bb93c4c411a19e5333e6f55fec7f5c2801d",
    "tests/fixtures/github_retrieval_parity_v5.queries.json": "2a87aed9b87b397b2d659f5a93d6ee1edd63ab1868a42a6448c7ce267f17c8a7"
  },
  "models": [
    {
      "dependencies": {
        "psutil": "6.0.0",
        "safetensors": "0.4.5",
        "tokenizers": "0.19.1",
        "torch": "2.4.1+cpu",
        "transformers": "4.44.2"
      },
      "documents": [
        {
          "best_chunk_score": 4.470765590667725,
          "character_count": 38086,
          "chunk_count": 96,
          "path": "corpora/github-retrieval-parity-v4/docs/2.-Evolution.md",
          "rank": 1,
          "source_id": "github:Liplus-Project/neuron-graph-rag:corpora/github-retrieval-parity-v4/docs/2.-Evolution.md",
          "winning_chunk_end_codepoint": 38086,
          "winning_chunk_index": 95,
          "winning_chunk_sha256": "85255bc7e1df253447257d972ff43fbbb822ef2f9d5ce7fe8d7d3a4c19a7b276",
          "winning_chunk_start_codepoint": 38000
        },
        {
          "best_chunk_score": 3.8685500621795654,
          "character_count": 58867,
          "chunk_count": 147,
          "path": "corpora/github-retrieval-parity-v4/docs/Decision-Structure.md",
          "rank": 2,
          "source_id": "github:Liplus-Project/neuron-graph-rag:corpora/github-retrieval-parity-v4/docs/Decision-Structure.md",
          "winning_chunk_end_codepoint": 9280,
          "winning_chunk_index": 22,
          "winning_chunk_sha256": "1395b84945de324103766ae426e458666ebd2de64f66495094f2d0ad3594b3fc",
          "winning_chunk_start_codepoint": 8800
        },
        {
          "best_chunk_score": -0.057602450251579285,
          "character_count": 950,
          "chunk_count": 3,
          "path": "corpora/github-retrieval-parity-v4/rules/model/foundational-invariant.md",
          "rank": 3,
          "source_id": "github:Liplus-Project/neuron-graph-rag:corpora/github-retrieval-parity-v4/rules/model/foundational-invariant.md",
          "winning_chunk_end_codepoint": 950,
          "winning_chunk_index": 2,
          "winning_chunk_sha256": "3180bdb32b240ea58309b5cb6adac022b86368e887ea74b2e3cb9d08048d20ff",
          "winning_chunk_start_codepoint": 800
        },
        {
          "best_chunk_score": -0.8665319681167603,
          "character_count": 27861,
          "chunk_count": 70,
          "path": "corpora/github-retrieval-parity-v4/docs/6.-Adapter.md",
          "rank": 4,
          "source_id": "github:Liplus-Project/neuron-graph-rag:corpora/github-retrieval-parity-v4/docs/6.-Adapter.md",
          "winning_chunk_end_codepoint": 8880,
          "winning_chunk_index": 21,
          "winning_chunk_sha256": "544f35d0ba6d6a2e6df2778c6bb374d62a0aa543c29a6ac3118310c47e333ff5",
          "winning_chunk_start_codepoint": 8400
        },
        {
          "best_chunk_score": -0.873387336730957,
          "character_count": 38898,
          "chunk_count": 98,
          "path": "corpora/github-retrieval-parity-v4/rules/operations/main-agent-procedures.md",
          "rank": 5,
          "source_id": "github:Liplus-Project/neuron-graph-rag:corpora/github-retrieval-parity-v4/rules/operations/main-agent-procedures.md",
          "winning_chunk_end_codepoint": 6480,
          "winning_chunk_index": 15,
          "winning_chunk_sha256": "e86f302dfb4426d4cfc6a2adabf234626deeff602a7a213ccd4fb073e1937b9c",
          "winning_chunk_start_codepoint": 6000
        },
        {
          "best_chunk_score": -1.053273320198059,
          "character_count": 54014,
          "chunk_count": 135,
          "path": "corpora/github-retrieval-parity-v4/docs/4.-Operations.md",
          "rank": 6,
          "source_id": "github:Liplus-Project/neuron-graph-rag:corpora/github-retrieval-parity-v4/docs/4.-Operations.md",
          "winning_chunk_end_codepoint": 6080,
          "winning_chunk_index": 14,
          "winning_chunk_sha256": "7dcc054247e2c589083e27f4f3e070438982feb33661d9827ca2665ef2ef7a10",
          "winning_chunk_start_codepoint": 5600
        },
        {
          "best_chunk_score": -1.0621205568313599,
          "character_count": 23194,
          "chunk_count": 58,
          "path": "corpora/github-retrieval-parity-v4/docs/1.-Model.md",
          "rank": 7,
          "source_id": "github:Liplus-Project/neuron-graph-rag:corpora/github-retrieval-parity-v4/docs/1.-Model.md",
          "winning_chunk_end_codepoint": 9680,
          "winning_chunk_index": 23,
          "winning_chunk_sha256": "cf33b407d772a197d30da41cbeec893ea85c08c4921315abb93df3e743aaa418",
          "winning_chunk_start_codepoint": 9200
        },
        {
          "best_chunk_score": -1.083122968673706,
          "character_count": 9307,
          "chunk_count": 24,
          "path": "corpora/github-retrieval-parity-v4/skills/evolution-self-eval/SKILL.md",
          "rank": 8,
          "source_id": "github:Liplus-Project/neuron-graph-rag:corpora/github-retrieval-parity-v4/skills/evolution-self-eval/SKILL.md",
          "winning_chunk_end_codepoint": 4080,
          "winning_chunk_index": 9,
          "winning_chunk_sha256": "a4603686783953d886740366a870b758d6b30f2c41a0228f580e82c796896c5e",
          "winning_chunk_start_codepoint": 3600
        },
        {
          "best_chunk_score": -1.1938095092773438,
          "character_count": 42485,
          "chunk_count": 107,
          "path": "corpora/github-retrieval-parity-v4/skills/evolution-parallel-agent-eval/SKILL.md",
          "rank": 9,
          "source_id": "github:Liplus-Project/neuron-graph-rag:corpora/github-retrieval-parity-v4/skills/evolution-parallel-agent-eval/SKILL.md",
          "winning_chunk_end_codepoint": 16080,
          "winning_chunk_index": 39,
          "winning_chunk_sha256": "f91896a91c9b0e255a592812a9b3cdbd471f51ebb6fc6a3301ae3eb4d8be0a3a",
          "winning_chunk_start_codepoint": 15600
        },
        {
          "best_chunk_score": -1.740195870399475,
          "character_count": 7645,
          "chunk_count": 19,
          "path": "corpora/github-retrieval-parity-v4/skills/task-subagent-delegation/SKILL.md",
          "rank": 10,
          "source_id": "github:Liplus-Project/neuron-graph-rag:corpora/github-retrieval-parity-v4/skills/task-subagent-delegation/SKILL.md",
          "winning_chunk_end_codepoint": 6080,
          "winning_chunk_index": 14,
          "winning_chunk_sha256": "e5b62a2494a982943773489f3d00cea3d6ce115736855c42cf7a87393e19501f",
          "winning_chunk_start_codepoint": 5600
        },
        {
          "best_chunk_score": -1.9380353689193726,
          "character_count": 3359,
          "chunk_count": 9,
          "path": "corpora/github-retrieval-parity-v4/skills/model-loop-safety/SKILL.md",
          "rank": 11,
          "source_id": "github:Liplus-Project/neuron-graph-rag:corpora/github-retrieval-parity-v4/skills/model-loop-safety/SKILL.md",
          "winning_chunk_end_codepoint": 1680,
          "winning_chunk_index": 3,
          "winning_chunk_sha256": "5211554dfdf988d58fa249e14c792d4f2c0cbaa5a602e66488631c8a0a04cae1",
          "winning_chunk_start_codepoint": 1200
        },
        {
          "best_chunk_score": -2.393551826477051,
          "character_count": 3561,
          "chunk_count": 9,
          "path": "corpora/github-retrieval-parity-v4/rules/model/subtractive-structural-beauty.md",
          "rank": 12,
          "source_id": "github:Liplus-Project/neuron-graph-rag:corpora/github-retrieval-parity-v4/rules/model/subtractive-structural-beauty.md",
          "winning_chunk_end_codepoint": 1680,
          "winning_chunk_index": 3,
          "winning_chunk_sha256": "edd99523644d338df03ba9e4c8599ea30487876b4284174c291e76c27f925dce",
          "winning_chunk_start_codepoint": 1200
        },
        {
          "best_chunk_score": -2.448214054107666,
          "character_count": 9260,
          "chunk_count": 23,
          "path": "corpora/github-retrieval-parity-v4/skills/evolution-decision-structure-write/SKILL.md",
          "rank": 13,
          "source_id": "github:Liplus-Project/neuron-graph-rag:corpora/github-retrieval-parity-v4/skills/evolution-decision-structure-write/SKILL.md",
          "winning_chunk_end_codepoint": 2480,
          "winning_chunk_index": 5,
          "winning_chunk_sha256": "4f77995d1cc1881e7814e27c50a161f3df0905ac08da926d0a68621ac6ff70e8",
          "winning_chunk_start_codepoint": 2000
        },
        {
          "best_chunk_score": -2.4578680992126465,
          "character_count": 3056,
          "chunk_count": 8,
          "path": "corpora/github-retrieval-parity-v4/rules/model/trigger-check-gate.md",
          "rank": 14,